{
  "id": "src-vg-cp2-site-work-2025-06-03",
  "url": "https://s205.q4cdn.com/622838971/files/doc_news/Venture-Global-Launches-Site-Work-at-CP2-LNG-Following-Federal-Approval-2025.pdf",
  "publisher": "Venture Global",
  "doc_type": "press_release",
  "primary": true,
  "published": "2025-06-03",
  "retrieved_at": "2026-10-04",
  "retrieved_by": "manual-seed",
  "snapshot_path": null,
  "quotes": [
    "At peak construction, CP2 is expected to employ approximately 7,500 direct construction jobs",
    "The Project is expected to support approximately 3,000 new jobs in Louisiana",
    "approximately 3,000 new jobs in Louisiana – 400 of which will be direct, permanent employees of CP2"
  ],
  "quote_verified": false,
  "terms_status": "n/a"
}
