{
  "id": "src-technip-bluepoint-2025-04-08",
  "url": "https://ten.com/sites/energies/files/2025-04/technipenergies-blue-point-number-one-atr-project.pdf",
  "publisher": "Technip Energies",
  "doc_type": "press_release",
  "primary": true,
  "published": "2025-04-08",
  "retrieved_at": "2026-10-04",
  "retrieved_by": "manual-seed",
  "snapshot_path": null,
  "quotes": [
    "Technip Energies will perform the engineering, procurement, equipment and module fabrication for the production facility",
    "Working with Topsoe to integrate its SynCOR Ammonia™ technology"
  ],
  "quote_verified": false,
  "terms_status": "n/a"
}
