{
  "id": "src-desmog-woodside-itep-2025-05-02",
  "url": "https://www.desmog.com/2025/05/02/louisiana-lng-tax-break-could-cost-local-communities-2-8-billion",
  "publisher": "DeSmog",
  "doc_type": "news",
  "primary": false,
  "published": "2025-05-02",
  "retrieved_at": "2026-10-04",
  "retrieved_by": "manual-seed",
  "snapshot_path": null,
  "quotes": [
    "350 permanent direct jobs"
  ],
  "quote_verified": false,
  "terms_status": "n/a"
}
