{
  "id": "src-doe-cp2-progress-2026-04-01",
  "url": "https://www.energy.gov/documents/vg-cp2-april-2026-doe-progress-report-draft-040126pdf",
  "publisher": "CP2 LNG (progress report filed with US DOE)",
  "doc_type": "docket_filing",
  "primary": true,
  "published": "2026-04-01",
  "retrieved_at": "2026-10-04",
  "retrieved_by": "manual-seed",
  "snapshot_path": null,
  "quotes": [
    "CP2 LNG is targeting the start of commercial operations of Phase 1 in late 2029 and of Phase 2 in mid-2030.",
    "Order Granting Authorizations Under Sections 3 and 7 of the Natural Gas Act\" for the CP2 LNG Project, and the related CP Express pipeline project, on June 27, 2024.",
    "Ordering Paragraph H of Order No. 4812 issued in HGEO Docket No. 21-131-LNG on April 22, 2022",
    "Ordering Paragraph (L) of Order No. 5264-A issued in that same docket on October 21, 2025."
  ],
  "quote_verified": false,
  "terms_status": "n/a"
}
