{
  "id": "src-recyclingtoday-hyundai-steel",
  "url": "https://www.recyclingtoday.com/news/hyundai-kia-steel-mill-louisiana-danieli-technology-land-purchase-development-award/",
  "publisher": "Recycling Today",
  "doc_type": "news",
  "primary": false,
  "published": null,
  "retrieved_at": "2026-09-30",
  "retrieved_by": "manual-seed",
  "snapshot_path": null,
  "quotes": [
    "a 1,700-acre site in Ascension Parish for $91 million to host the planned $5.8 billion mill"
  ],
  "quote_verified": false,
  "terms_status": "n/a"
}
