{
  "id": "src-turner-richland-resource-page",
  "url": "https://www.turnerconstruction.com/pages/richland-parish-data-center-resource-page",
  "publisher": "Turner Construction",
  "doc_type": "other",
  "primary": true,
  "published": null,
  "retrieved_at": "2026-10-04",
  "retrieved_by": "manual-seed",
  "snapshot_path": null,
  "quotes": [
    "Turner is currently delivering Phase 1 of the campus alongside DPR Construction and M. A. Mortenson"
  ],
  "quote_verified": false,
  "terms_status": "n/a"
}
