{
  "id": "src-illuminator-lng-pollution-2026-04-07",
  "url": "https://lailluminator.com/2026/04/07/lng-pollution/",
  "publisher": "Louisiana Illuminator",
  "doc_type": "news",
  "primary": false,
  "published": "2026-04-07",
  "retrieved_at": "2026-10-04",
  "retrieved_by": "manual-seed",
  "snapshot_path": null,
  "quotes": [
    "The company acquired the 1,000-acre Calcasieu Parish terminal site in 2024 from Houston-based Tellurian"
  ],
  "quote_verified": false,
  "terms_status": "n/a"
}
