{
  "id": "src-vg-cp2-page",
  "url": "https://ventureglobal.com/projects-cp2/",
  "publisher": "Venture Global",
  "doc_type": "other",
  "primary": true,
  "published": "2022-08-22",
  "retrieved_at": "2026-10-04",
  "retrieved_by": "manual-seed",
  "snapshot_path": null,
  "quotes": [
    "The CP2 terminal facility is located on an approximately 1,150 acre site adjacent to Venture Global's Calcasieu Pass LNG facility"
  ],
  "quote_verified": false,
  "terms_status": "n/a"
}
