{
  "id": "src-meta-richland-contracts-2025-12-19",
  "url": "https://about.fb.com/news/2025/12/metas-richland-parish-data-center-supports-louisiana-economy-875-million-in-contracts/",
  "publisher": "Meta",
  "doc_type": "press_release",
  "primary": true,
  "published": "2025-12-19",
  "retrieved_at": "2026-10-04",
  "retrieved_by": "manual-seed",
  "snapshot_path": null,
  "quotes": [
    "The buildout of the Richland Parish Data Center is led by three general contractors — Turner Construction Company, DPR Construction, and Mortensen Construction"
  ],
  "quote_verified": false,
  "terms_status": "n/a"
}
