{
  "id": "src-woodside-latest-look-2026-08-06",
  "url": "https://www.woodside.com/media-centre/news-stories/story/latest-look-inside-louisiana-lng",
  "publisher": "Woodside Energy",
  "doc_type": "press_release",
  "primary": true,
  "published": "2026-08-06",
  "retrieved_at": "2026-09-30",
  "retrieved_by": "manual-seed",
  "snapshot_path": null,
  "quotes": [
    "Louisiana LNG project constitutes a US$17.5 billion investment",
    "Louisiana LNG continues to gather momentum, with the project on the US Gulf Coast now 28 per cent complete",
    "work towards first LNG cargo in 2029"
  ],
  "quote_verified": false,
  "terms_status": "n/a"
}
