{
  "id": "src-fortune-meta-2026-03-26",
  "url": "https://fortune.com/2026/03/26/meta-ai-data-center-hyperion-louisiana/",
  "publisher": "Fortune",
  "doc_type": "news",
  "primary": false,
  "published": "2026-03-26",
  "retrieved_at": "2026-09-30",
  "retrieved_by": "manual-seed",
  "snapshot_path": null,
  "quotes": [
    "an arrangement targeting up to $27 billion in total development costs"
  ],
  "quote_verified": false,
  "terms_status": "n/a"
}
