{
  "id": "src-led-bluepoint-fid-2025-04-08",
  "url": "https://www.opportunitylouisiana.gov/news/another-louisiana-win-cf-industries-jera-and-mitsui-announce-4-billion-final-investment-decision-to-construct-worlds-largest-ammonia-facility-in-ascension-parish",
  "publisher": "Louisiana Economic Development",
  "doc_type": "press_release",
  "primary": true,
  "published": "2025-04-08",
  "retrieved_at": "2026-09-30",
  "retrieved_by": "manual-seed",
  "snapshot_path": null,
  "quotes": [
    "its partners have announced an approximately $4 billion final investment decision to establish a low-carbon ammonia facility",
    "The project is expected to create 103 direct new permanent jobs with an average salary of $110,000.",
    "311 indirect new jobs, for a total of 414 potential new jobs in the Capital Region."
  ],
  "quote_verified": false,
  "terms_status": "approved"
}
