{
  "id": "src-bw-bluepoint-groundbreaking-2026-08-26",
  "url": "https://www.businesswire.com/news/home/20260826407037/en/CF-Industries-JERA-Co.-and-Mitsui-Co.-Ltd.-Break-Ground-on-Blue-Point-One-the-Worlds-Largest-Low-Carbon-Ammonia-Plant-in-Louisiana",
  "publisher": "CF Industries, JERA and Mitsui (Business Wire)",
  "doc_type": "press_release",
  "primary": true,
  "published": "2026-08-26",
  "retrieved_at": "2026-09-30",
  "retrieved_by": "manual-seed",
  "snapshot_path": null,
  "quotes": [
    "$3.7 billion investment by Blue Point One joint venture members, with contributions allocated according to ownership levels.",
    "is located in Modeste, Louisiana, and is expected to begin production in 2029.",
    "The ammonia plant will have an average annual capacity of 1.4 million metric tons.",
    "An estimated 3,900 construction jobs will be created over four years."
  ],
  "quote_verified": false,
  "terms_status": "n/a"
}
