{
  "id": "src-led-next-frontier-2026-09-10",
  "url": "https://www.opportunitylouisiana.gov/news/the-next-frontier-of-american-industry-starts-in-louisiana",
  "publisher": "Louisiana Economic Development",
  "doc_type": "press_release",
  "primary": true,
  "published": "2026-09-10",
  "retrieved_at": "2026-09-30",
  "retrieved_by": "manual-seed",
  "snapshot_path": null,
  "quotes": [
    "SpaceX's $100 billion Starbase Louisiana will establish the world's largest spaceport in Vermilion Parish"
  ],
  "quote_verified": false,
  "terms_status": "approved"
}
