{
  "id": "src-led-hyundai-steel-2025-03-24",
  "url": "https://www.opportunitylouisiana.gov/news/louisiana-wins-again-governor-jeff-landry-led-secure-5-8-billion-hyundai-steel-plant",
  "publisher": "Louisiana Economic Development",
  "doc_type": "press_release",
  "primary": true,
  "published": "2025-03-24",
  "retrieved_at": "2026-10-04",
  "retrieved_by": "manual-seed",
  "snapshot_path": null,
  "quotes": [
    "create more than 1,300 direct new jobs",
    "about 4,100 indirect new jobs, for a total of 5,400 potential new jobs",
    "approximately 1,700 acres"
  ],
  "quote_verified": false,
  "terms_status": "approved"
}
