{
  "id": "src-hmg-hyundai-steel-2026-09-05",
  "url": "https://www.hyundaimotorgroup.com/en/news/hyundai-steel-celebrates-louisiana-eaf-steel-mill-project-launch-driving-growth-for-us-manufacturing",
  "publisher": "Hyundai Motor Group",
  "doc_type": "press_release",
  "primary": true,
  "published": "2026-09-05",
  "retrieved_at": "2026-09-30",
  "retrieved_by": "manual-seed",
  "snapshot_path": null,
  "quotes": [
    "Hyundai Steel Company held a ceremonial event today for a $5.8 billion Electric Arc Furnace-based integrated steel mill",
    "With commercial production targeted for 2029",
    "annual capacity of 2.7 million metric tons of hot-rolled and cold-rolled steel sheets",
    "is expected to create 5,400 jobs, including 1,300 direct positions."
  ],
  "quote_verified": false,
  "terms_status": "n/a"
}
