{
  "id": "src-vg-q2-2026-results-2026-08-11",
  "url": "https://ventureglobal.com/2026/08/11/venture-global-reports-second-quarter-2026-results/",
  "publisher": "Venture Global",
  "doc_type": "press_release",
  "primary": true,
  "published": "2026-08-11",
  "retrieved_at": "2026-09-30",
  "retrieved_by": "manual-seed",
  "snapshot_path": null,
  "quotes": [
    "Construction at our CP2 Project continues to advance well, and we remain on schedule to produce first LNG in the second half of 2027."
  ],
  "quote_verified": false,
  "terms_status": "n/a"
}
