{
  "id": "src-wrkf-woodside-groundbreaking-2025-09-18",
  "url": "https://www.wrkf.org/2025-09-18/state-local-officials-break-ground-on-woodside-lng-project-in-calcasieu-parish",
  "publisher": "WRKF",
  "doc_type": "news",
  "primary": false,
  "published": "2025-09-18",
  "retrieved_at": "2026-10-04",
  "retrieved_by": "manual-seed",
  "snapshot_path": null,
  "quotes": [
    "more than 4,400 jobs at the site during construction, a majority of which will be American workers"
  ],
  "quote_verified": false,
  "terms_status": "n/a"
}
