{
  "id": "src-vg-cp2-phase2-fid-2026-03-13",
  "url": "https://investors.ventureglobal.com/news/news-details/2026/Venture-Global-Announces-Final-Investment-Decision-and-Financial-Close-for-Phase-2-of-CP2-LNG/default.aspx",
  "publisher": "Venture Global",
  "doc_type": "press_release",
  "primary": true,
  "published": "2026-03-13",
  "retrieved_at": "2026-09-30",
  "retrieved_by": "manual-seed",
  "snapshot_path": null,
  "quotes": [
    "project's total financing to $20.7 billion",
    "$8.6 billion project financing for CP2 Phase 2",
    "with the Phase Two financing secured, we will build on the strong construction progress already underway",
    "CP2 will have a peak production capacity of 29 MTPA"
  ],
  "quote_verified": false,
  "terms_status": "n/a"
}
