{
  "id": "src-modernmetals-hyundai-danieli",
  "url": "https://www.modernmetals.com/hyundai-posco-louisiana-steel-selects-danieli-for-integrated-steel-plant-project-in-the-usa.html",
  "publisher": "Modern Metals",
  "doc_type": "news",
  "primary": false,
  "published": null,
  "retrieved_at": "2026-10-04",
  "retrieved_by": "manual-seed",
  "snapshot_path": null,
  "quotes": [
    "The contracts awarded to Danieli includes the supply of two electric arc furnaces with secondary metallurgy, two thick slab casters, and two slab reheating furnaces.",
    "The ENERGIRON consortium by Tenova and Danieli has been selected as the supplier for the direct reduction plant."
  ],
  "quote_verified": false,
  "terms_status": "n/a"
}
